{
  "version": 1,
  "nodes": [
    {
      "name": "scalp",
      "type": "Scalp"
    },
    {
      "name": "guides",
      "type": "Guides"
    },
    {
      "name": "primaries",
      "type": "Guides",
      "params": {
        "level": 0
      }
    },
    {
      "name": "scatter",
      "type": "Scatter",
      "params": {
        "density": {
          "texture": "../../textures/density.pgm",
          "component": "luminance",
          "min": 0.0,
          "max": 400.0
        }
      }
    },
    {
      "name": "resample",
      "type": "Resample",
      "params": {
        "segments": 9
      }
    },
    {
      "name": "interpolate",
      "type": "Interpolate"
    },
    {
      "name": "clump",
      "type": "Clump",
      "params": {
        "count": 25,
        "strength": {
          "colorSet": "colorSet1",
          "component": "r",
          "min": 0.0,
          "max": 0.9
        },
        "profile": [
          [
            0.0,
            0.0
          ],
          [
            0.6,
            1.0
          ],
          [
            1.0,
            0.8
          ]
        ]
      }
    },
    {
      "name": "clump2",
      "type": "Clump",
      "params": {
        "strength": 0.3,
        "centersFrom": "inputCurves"
      }
    },
    {
      "name": "noise",
      "type": "Noise",
      "params": {
        "amplitude": 0.03,
        "profile": [
          [
            0.0,
            0.0
          ],
          [
            1.0,
            1.0
          ]
        ]
      }
    },
    {
      "name": "curl",
      "type": "Curl",
      "params": {
        "radius": 0.02
      }
    },
    {
      "name": "frizz",
      "type": "Noise",
      "params": {
        "fraction": 0.2,
        "frequency": 8.0,
        "octaves": 1
      }
    },
    {
      "name": "attr",
      "type": "Attribute",
      "params": {
        "name": "len",
        "value": {
          "expression": "rand",
          "min": 0.6,
          "max": 1.0
        }
      }
    },
    {
      "name": "length",
      "type": "Length",
      "params": {
        "keep": {
          "attribute": "len",
          "min": 0.0,
          "max": 1.0
        }
      }
    },
    {
      "name": "comb",
      "type": "Bend",
      "params": {
        "angle": 20.0,
        "along": "direction",
        "direction": [
          0.0,
          -1.0,
          0.2
        ]
      }
    },
    {
      "name": "collide",
      "type": "Collide",
      "params": {
        "offset": 0.01
      }
    },
    {
      "name": "more",
      "type": "Scatter",
      "params": {
        "density": 20.0,
        "seed": 3
      }
    },
    {
      "name": "merge",
      "type": "Merge"
    },
    {
      "name": "switch",
      "type": "Switch",
      "params": {
        "index": 0
      }
    },
    {
      "name": "width",
      "type": "Width",
      "params": {
        "width": 0.01,
        "profile": [
          [
            0.0,
            1.0
          ],
          [
            1.0,
            0.2
          ]
        ]
      }
    },
    {
      "name": "output",
      "type": "Output"
    }
  ],
  "output": "output",
  "connections": [
    {
      "from": "scalp",
      "to": "scatter",
      "input": "scalp"
    },
    {
      "from": "scatter",
      "to": "interpolate",
      "input": "strands"
    },
    {
      "from": "guides",
      "to": "interpolate",
      "input": "guides"
    },
    {
      "from": "scalp",
      "to": "interpolate",
      "input": "scalp"
    },
    {
      "from": "interpolate",
      "to": "clump",
      "input": "strands"
    },
    {
      "from": "clump",
      "to": "clump2",
      "input": "strands"
    },
    {
      "from": "primaries",
      "to": "clump2",
      "input": "centers"
    },
    {
      "from": "clump2",
      "to": "noise",
      "input": "strands"
    },
    {
      "from": "noise",
      "to": "curl",
      "input": "strands"
    },
    {
      "from": "curl",
      "to": "frizz",
      "input": "strands"
    },
    {
      "from": "frizz",
      "to": "attr",
      "input": "strands"
    },
    {
      "from": "attr",
      "to": "length",
      "input": "strands"
    },
    {
      "from": "length",
      "to": "comb",
      "input": "strands"
    },
    {
      "from": "comb",
      "to": "collide",
      "input": "strands"
    },
    {
      "from": "scalp",
      "to": "collide",
      "input": "scalp"
    },
    {
      "from": "scalp",
      "to": "more",
      "input": "scalp"
    },
    {
      "from": "collide",
      "to": "merge",
      "input": "a"
    },
    {
      "from": "more",
      "to": "merge",
      "input": "b"
    },
    {
      "from": "merge",
      "to": "switch",
      "input": "a"
    },
    {
      "from": "switch",
      "to": "width",
      "input": "strands"
    },
    {
      "from": "width",
      "to": "output",
      "input": "strands"
    }
  ]
}
